{
    "version": 1,
    "model_ec": ["P10_10"],
    "registers": {
        "PB_STATION_FIR_EQ": {
            "instances": {
                "0": "0x03011000",
                "1": "0x03011040",
                "2": "0x03011080",
                "3": "0x030110C0",
                "4": "0x03011100",
                "5": "0x03011140",
                "6": "0x03011180",
                "7": "0x030111C0"
            }
        },
        "PB_STATION_FIR_EQ_MASK": {
            "instances": {
                "0": "0x03011003",
                "1": "0x03011043",
                "2": "0x03011083",
                "3": "0x030110C3",
                "4": "0x03011103",
                "5": "0x03011143",
                "6": "0x03011183",
                "7": "0x030111C3"
            }
        },
        "PB_STATION_FIR_EQ_ACT0": {
            "instances": {
                "0": "0x03011006",
                "1": "0x03011046",
                "2": "0x03011086",
                "3": "0x030110C6",
                "4": "0x03011106",
                "5": "0x03011146",
                "6": "0x03011186",
                "7": "0x030111C6"
            }
        },
        "PB_STATION_FIR_EQ_ACT1": {
            "instances": {
                "0": "0x03011007",
                "1": "0x03011047",
                "2": "0x03011087",
                "3": "0x030110C7",
                "4": "0x03011107",
                "5": "0x03011147",
                "6": "0x03011187",
                "7": "0x030111C7"
            }
        }
    },
    "isolation_nodes": {
        "PB_STATION_FIR_EQ": {
            "instances": [0, 1, 2, 3, 4, 5, 6, 7],
            "rules": [
                {
                    "attn_type": ["CS"],
                    "node_inst": [0, 1, 2, 3, 4, 5, 6, 7],
                    "expr": {
                        "expr_type": "and",
                        "exprs": [
                            {
                                "expr_type": "reg",
                                "reg_name": "PB_STATION_FIR_EQ"
                            },
                            {
                                "expr_type": "not",
                                "expr": {
                                    "expr_type": "reg",
                                    "reg_name": "PB_STATION_FIR_EQ_MASK"
                                }
                            },
                            {
                                "expr_type": "not",
                                "expr": {
                                    "expr_type": "reg",
                                    "reg_name": "PB_STATION_FIR_EQ_ACT0"
                                }
                            },
                            {
                                "expr_type": "not",
                                "expr": {
                                    "expr_type": "reg",
                                    "reg_name": "PB_STATION_FIR_EQ_ACT1"
                                }
                            }
                        ]
                    }
                },
                {
                    "attn_type": ["RE"],
                    "node_inst": [0, 1, 2, 3, 4, 5, 6, 7],
                    "expr": {
                        "expr_type": "and",
                        "exprs": [
                            {
                                "expr_type": "reg",
                                "reg_name": "PB_STATION_FIR_EQ"
                            },
                            {
                                "expr_type": "not",
                                "expr": {
                                    "expr_type": "reg",
                                    "reg_name": "PB_STATION_FIR_EQ_MASK"
                                }
                            },
                            {
                                "expr_type": "not",
                                "expr": {
                                    "expr_type": "reg",
                                    "reg_name": "PB_STATION_FIR_EQ_ACT0"
                                }
                            },
                            {
                                "expr_type": "reg",
                                "reg_name": "PB_STATION_FIR_EQ_ACT1"
                            }
                        ]
                    }
                },
                {
                    "attn_type": ["SPA"],
                    "node_inst": [0, 1, 2, 3, 4, 5, 6, 7],
                    "expr": {
                        "expr_type": "and",
                        "exprs": [
                            {
                                "expr_type": "reg",
                                "reg_name": "PB_STATION_FIR_EQ"
                            },
                            {
                                "expr_type": "not",
                                "expr": {
                                    "expr_type": "reg",
                                    "reg_name": "PB_STATION_FIR_EQ_MASK"
                                }
                            },
                            {
                                "expr_type": "reg",
                                "reg_name": "PB_STATION_FIR_EQ_ACT0"
                            },
                            {
                                "expr_type": "not",
                                "expr": {
                                    "expr_type": "reg",
                                    "reg_name": "PB_STATION_FIR_EQ_ACT1"
                                }
                            }
                        ]
                    }
                }
            ],
            "bits": {
                "0": {
                    "desc": "protocol_error"
                },
                "1": {
                    "desc": "overflow_error"
                },
                "2": {
                    "desc": "hw_parity_error"
                },
                "3": {
                    "desc": "spare"
                },
                "4": {
                    "desc": "coherency_error"
                },
                "5": {
                    "desc": "cresp_addr_error"
                },
                "6": {
                    "desc": "cresp_error"
                },
                "7": {
                    "desc": "hang_recovery_limit_error"
                },
                "8": {
                    "desc": "spare"
                },
                "9": {
                    "desc": "hang_recovery_gte_level1"
                },
                "10": {
                    "desc": "force_mp_ipl"
                },
                "11": {
                    "desc": "pb_cmd_snooper_error"
                },
                "12": {
                    "desc": "data_overflow_error"
                },
                "13": {
                    "desc": "data_protocol_error"
                },
                "14": {
                    "desc": "data_route_error"
                },
                "15": {
                    "desc": "fir_compab_trigger"
                },
                "16": {
                    "desc": "link0_protocol_error"
                },
                "17": {
                    "desc": "link0_overflow_error"
                },
                "18": {
                    "desc": "link0_hw_parity_error"
                },
                "19": {
                    "desc": "link1_protocol_error"
                },
                "20": {
                    "desc": "link1_overflow_error"
                },
                "21": {
                    "desc": "link1_hw_parity_error"
                }
            },
            "capture_groups": [
                {
                    "group_name": "PB_STATION_FIR_EQ",
                    "group_inst": {
                        "0": 0,
                        "1": 1,
                        "2": 2,
                        "3": 3,
                        "4": 4,
                        "5": 5,
                        "6": 6,
                        "7": 7
                    }
                }
            ]
        }
    }
}
